{
  "contract_version": "1.0",
  "request_id": "req-002",
  "status": "ERROR",
  "correlation_ids": ["task-001", "cmd-002", "changeset-100"],
  "error": {
    "error_code": "REVISION_CONFLICT",
    "category": "CONSISTENCY",
    "message": "Document has changed since the planning snapshot",
    "correlation_ids": ["task-001", "cmd-002"],
    "retryable": "AFTER_RECONSTRUCT",
    "details": [{"expected_revision": 100, "actual_revision": 101}]
  }
}
